{
  "journey_id": "JRN-016",
  "document_version": "0.1.0",
  "status": "Draft",
  "architectural_principle": "Cross-capability communication is exclusively async events. Within a capability, services communicate freely.",
  "services": [
    {
      "service_id": "SVC-001",
      "service_name": "Retail Banking Core",
      "capability_id": "CAP-001",
      "role_in_journey": "Owns OverdraftReview (ENT-054). Triggers nightly review batch. Performs persistent debt screening against transaction ledger. Makes review decision (renew/modify/withdraw/suspend). Updates Account (ENT-004) overdraft terms. Publishes all JRN-016 events.",
      "owned_entities": ["ENT-054"],
      "new_owned_entities_this_journey": ["ENT-054"],
      "published_events": ["EVT-114", "EVT-116", "EVT-117", "EVT-118"],
      "consumed_events": [
        {
          "event_id": "EVT-115",
          "name": "OverdraftAssessmentCompleted",
          "provider_service_id": "SVC-012",
          "purpose": "JRN-016 PH-084 -> PH-085: SVC-001 receives credit assessment and behavioural analysis results from SVC-012. Proceeds to persistent debt screening.",
          "maps_to": {
            "entity": "ENT-054",
            "field_mappings": [
              {"event_field": "credit_bureau_score", "entity_field": "credit_bureau_score"},
              {"event_field": "credit_grade", "entity_field": "credit_grade"},
              {"event_field": "affordability_score", "entity_field": "affordability_score"},
              {"event_field": "avg_monthly_credit_turnover", "entity_field": "avg_monthly_credit_turnover"},
              {"event_field": "overdraft_utilisation_days", "entity_field": "overdraft_utilisation_days"},
              {"event_field": "missed_payment_count", "entity_field": "missed_payment_count"}
            ]
          }
        }
      ],
      "consumed_apis": [],
      "design_decisions": [
        {
          "decision": "SVC-001 owns OverdraftReview (ENT-054) because the review is a retail banking product lifecycle event. SVC-012 provides the credit assessment as input, but the decision and terms update belong to the product owner.",
          "rationale": "Clean boundary: SVC-012 (Risk Engine, CAP-004) provides risk assessment; SVC-001 (Retail Banking Core, CAP-001) makes the product decision and owns the customer relationship."
        }
      ]
    },
    {
      "service_id": "SVC-012",
      "service_name": "Risk Engine",
      "capability_id": "CAP-004",
      "role_in_journey": "Performs credit bureau refresh and behavioural analysis at PH-084. Produces credit grade and affordability score. Publishes OverdraftAssessmentCompleted (EVT-115). Does not make the review decision — only provides risk assessment input.",
      "owned_entities": [],
      "published_events": ["EVT-115"],
      "consumed_events": [
        {
          "event_id": "EVT-114",
          "name": "OverdraftReviewTriggered",
          "provider_service_id": "SVC-001",
          "purpose": "JRN-016 PH-083 -> PH-084: SVC-012 receives review trigger from SVC-001. Initiates credit bureau refresh and behavioural analysis for the specified account.",
          "maps_to": {
            "entity": null,
            "field_mappings": [
              {"event_field": "account_id", "note": "Used to look up customer and initiate bureau refresh"},
              {"event_field": "customer_id", "note": "Used for credit bureau query"},
              {"event_field": "review_id", "note": "Correlation ID for the assessment response"}
            ]
          }
        }
      ],
      "consumed_apis": [
        {
          "provider_service_id": "EXT-BUREAU",
          "provider_service_name": "Credit Bureau API (Experian/Equifax/TransUnion)",
          "call_pattern": "Synchronous (blocking, P99 < 5,000ms with retry)",
          "dependency_criticality": "soft",
          "purpose": "Refreshes credit bureau data for the customer. Returns credit score, adverse data flags, and financial commitments."
        }
      ],
      "design_decisions": [
        {
          "decision": "SVC-012 (CAP-004) provides the credit assessment via async event (EVT-115), not via a synchronous API call from SVC-001.",
          "rationale": "Cross-capability communication rule: CAP-001 -> CAP-004 must be async. SVC-001 publishes OverdraftReviewTriggered; SVC-012 consumes it, performs assessment, and publishes OverdraftAssessmentCompleted. No synchronous cross-capability call."
        }
      ]
    }
  ],
  "cross_service_interaction_summary": [
    {
      "from": "SVC-001",
      "to": "SVC-012",
      "pattern": "Async event via Event Bus — OverdraftReviewTriggered (EVT-114)",
      "phase": "PH-083 -> PH-084",
      "cross_capability": true,
      "note": "CAP-001 -> CAP-004 boundary. Triggers credit assessment."
    },
    {
      "from": "SVC-012",
      "to": "SVC-001",
      "pattern": "Async event via Event Bus — OverdraftAssessmentCompleted (EVT-115)",
      "phase": "PH-084 -> PH-085",
      "cross_capability": true,
      "note": "CAP-004 -> CAP-001 boundary. Returns assessment results."
    },
    {
      "from": "SVC-012",
      "to": "EXT-BUREAU",
      "pattern": "Synchronous REST — Credit bureau API call",
      "phase": "PH-084",
      "cross_capability": false,
      "note": "External system call. SVC-012 -> Experian/Equifax/TransUnion."
    },
    {
      "from": "SVC-001",
      "to": "SVC-053",
      "pattern": "Async — notification dispatch",
      "phase": "PH-087",
      "cross_capability": false,
      "note": "Platform service call. Not a cross-capability interaction."
    }
  ]
}
